[
  {
    "id": "symptom_sleep_light_001",
    "label": "light sleep",
    "knowledge_source_type": "internal_rule",
    "tkrc_body_system": "sleep",
    "tkrc_therapeutic_area": "nidra_support",
    "dosha_action_profile": { "vata": "up", "pitta": "neutral", "kapha": "down" },
    "indication_band": "mild_general",
    "safety_band": "low_risk",
    "watch_suitability": "high",
    "contraindication_flags": [],
    "escalation_triggers": ["persistent_insomnia", "distress"],
    "prior_art_reference_type": "internal_logic_rule",
    "confidence_level": "medium",
    "human_review_status": "pending",
    "tags": ["sleep", "vata", "night_routine"]
  },
  {
    "id": "symptom_bloating_001",
    "label": "abdominal bloating",
    "knowledge_source_type": "internal_rule",
    "tkrc_body_system": "digestive",
    "tkrc_therapeutic_area": "agni_support",
    "dosha_action_profile": { "vata": "up", "pitta": "neutral", "kapha": "up" },
    "indication_band": "non_acute_digestive_discomfort",
    "safety_band": "low_risk",
    "watch_suitability": "high",
    "contraindication_flags": [],
    "escalation_triggers": ["persistent_vomiting", "severe_pain"],
    "prior_art_reference_type": "internal_logic_rule",
    "confidence_level": "medium",
    "human_review_status": "pending",
    "tags": ["digestive", "vata", "kapha", "agni"]
  },
  {
    "id": "symptom_fatigue_001",
    "label": "low energy / fatigue",
    "knowledge_source_type": "internal_rule",
    "tkrc_body_system": "general",
    "tkrc_therapeutic_area": "general_support",
    "dosha_action_profile": { "vata": "up", "pitta": "neutral", "kapha": "up" },
    "indication_band": "mild_general",
    "safety_band": "low_risk",
    "watch_suitability": "high",
    "contraindication_flags": [],
    "escalation_triggers": ["fainting", "chest_pain"],
    "prior_art_reference_type": "internal_logic_rule",
    "confidence_level": "medium",
    "human_review_status": "pending",
    "tags": ["fatigue", "energy", "vata", "kapha"]
  },
  {
    "id": "symptom_anxiety_stress_001",
    "label": "anxiety / stress",
    "knowledge_source_type": "internal_rule",
    "tkrc_body_system": "mental_wellbeing",
    "tkrc_therapeutic_area": "stress_regulation",
    "dosha_action_profile": { "vata": "up", "pitta": "up", "kapha": "neutral" },
    "indication_band": "stress_related",
    "safety_band": "low_risk",
    "watch_suitability": "high",
    "contraindication_flags": [],
    "escalation_triggers": ["distress", "confusion"],
    "prior_art_reference_type": "internal_logic_rule",
    "confidence_level": "medium",
    "human_review_status": "pending",
    "tags": ["mental", "stress", "vata", "pitta"]
  },
  {
    "id": "symptom_dry_skin_001",
    "label": "dryness / dry skin",
    "knowledge_source_type": "internal_rule",
    "tkrc_body_system": "skin",
    "tkrc_therapeutic_area": "general_support",
    "dosha_action_profile": { "vata": "up", "pitta": "neutral", "kapha": "neutral" },
    "indication_band": "mild_general",
    "safety_band": "low_risk",
    "watch_suitability": "high",
    "contraindication_flags": [],
    "escalation_triggers": [],
    "prior_art_reference_type": "internal_logic_rule",
    "confidence_level": "medium",
    "human_review_status": "pending",
    "tags": ["skin", "vata", "moisture"]
  },
  {
    "id": "symptom_indigestion_001",
    "label": "indigestion / slow digestion",
    "knowledge_source_type": "internal_rule",
    "tkrc_body_system": "digestive",
    "tkrc_therapeutic_area": "agni_support",
    "dosha_action_profile": { "vata": "neutral", "pitta": "neutral", "kapha": "up" },
    "indication_band": "non_acute_digestive_discomfort",
    "safety_band": "low_risk",
    "watch_suitability": "high",
    "contraindication_flags": [],
    "escalation_triggers": ["persistent_vomiting"],
    "prior_art_reference_type": "internal_logic_rule",
    "confidence_level": "medium",
    "human_review_status": "pending",
    "tags": ["digestive", "kapha", "agni", "metabolism"]
  },
  {
    "id": "symptom_joint_stiffness_001",
    "label": "joint stiffness",
    "knowledge_source_type": "internal_rule",
    "tkrc_body_system": "musculoskeletal",
    "tkrc_therapeutic_area": "general_support",
    "dosha_action_profile": { "vata": "up", "pitta": "neutral", "kapha": "neutral" },
    "indication_band": "mild_general",
    "safety_band": "requires_caution",
    "watch_suitability": "medium",
    "contraindication_flags": ["elderly"],
    "escalation_triggers": ["severe_pain"],
    "prior_art_reference_type": "internal_logic_rule",
    "confidence_level": "low",
    "human_review_status": "pending",
    "tags": ["joints", "vata", "movement", "morning"]
  },
  {
    "id": "symptom_respiratory_congestion_001",
    "label": "nasal congestion / respiratory heaviness",
    "knowledge_source_type": "internal_rule",
    "tkrc_body_system": "respiratory",
    "tkrc_therapeutic_area": "kapha_management",
    "dosha_action_profile": { "vata": "neutral", "pitta": "neutral", "kapha": "up" },
    "indication_band": "seasonal_balance",
    "safety_band": "low_risk",
    "watch_suitability": "high",
    "contraindication_flags": [],
    "escalation_triggers": ["breathing_difficulty"],
    "prior_art_reference_type": "internal_logic_rule",
    "confidence_level": "medium",
    "human_review_status": "pending",
    "tags": ["respiratory", "kapha", "seasonal", "congestion"]
  }
]
