[
  {
    "id": "classical_charaka_sutra_001",
    "label": "Charaka Samhita — Sutra Sthana overview",
    "knowledge_source_type": "classical_text",
    "classical_text_ref": "Charaka Samhita",
    "chapter_ref": "Sutra Sthana 1",
    "verse_ref": "1.1-15",
    "tkrc_body_system": "general",
    "tkrc_therapeutic_area": "general_support",
    "prior_art_reference_type": "classical_text",
    "confidence_level": "high",
    "human_review_status": "reviewed",
    "tags": ["charaka", "sutra", "foundational", "ayurveda_principles"]
  },
  {
    "id": "classical_charaka_dinacharya_001",
    "label": "Charaka Samhita — dinacharya daily routine",
    "knowledge_source_type": "classical_text",
    "classical_text_ref": "Charaka Samhita",
    "chapter_ref": "Sutra Sthana 5",
    "verse_ref": "5.1-20",
    "tkrc_body_system": "daily_routine",
    "tkrc_therapeutic_area": "daily_routine_support",
    "prior_art_reference_type": "classical_text",
    "confidence_level": "high",
    "human_review_status": "reviewed",
    "tags": ["dinacharya", "routine", "preventive_care", "morning"]
  },
  {
    "id": "classical_charaka_ahara_001",
    "label": "Charaka Samhita — ahara (diet) principles",
    "knowledge_source_type": "classical_text",
    "classical_text_ref": "Charaka Samhita",
    "chapter_ref": "Sutra Sthana 6",
    "verse_ref": "6.1-35",
    "tkrc_body_system": "digestive",
    "tkrc_therapeutic_area": "agni_support",
    "prior_art_reference_type": "classical_text",
    "confidence_level": "high",
    "human_review_status": "reviewed",
    "tags": ["ahara", "diet", "agni", "digestive", "seasonal"]
  },
  {
    "id": "classical_charaka_nidra_001",
    "label": "Charaka Samhita — nidra (sleep) and its importance",
    "knowledge_source_type": "classical_text",
    "classical_text_ref": "Charaka Samhita",
    "chapter_ref": "Sutra Sthana 21",
    "verse_ref": "21.36-58",
    "tkrc_body_system": "sleep",
    "tkrc_therapeutic_area": "nidra_support",
    "prior_art_reference_type": "classical_text",
    "confidence_level": "high",
    "human_review_status": "reviewed",
    "tags": ["nidra", "sleep", "rest", "recovery"]
  },
  {
    "id": "classical_charaka_prakriti_001",
    "label": "Charaka Samhita — prakriti classification",
    "knowledge_source_type": "classical_text",
    "classical_text_ref": "Charaka Samhita",
    "chapter_ref": "Vimana Sthana 8",
    "verse_ref": "8.95-110",
    "tkrc_body_system": "general",
    "tkrc_therapeutic_area": "general_support",
    "prior_art_reference_type": "classical_text",
    "confidence_level": "high",
    "human_review_status": "reviewed",
    "tags": ["prakriti", "dosha", "constitution", "vata", "pitta", "kapha"]
  },
  {
    "id": "classical_charaka_ritucharya_001",
    "label": "Charaka Samhita — ritucharya seasonal regimen",
    "knowledge_source_type": "classical_text",
    "classical_text_ref": "Charaka Samhita",
    "chapter_ref": "Sutra Sthana 6",
    "verse_ref": "6.36-50",
    "tkrc_body_system": "general",
    "tkrc_therapeutic_area": "daily_routine_support",
    "prior_art_reference_type": "classical_text",
    "confidence_level": "high",
    "human_review_status": "reviewed",
    "tags": ["ritucharya", "seasonal", "routine", "preventive_care"]
  },
  {
    "id": "classical_charaka_manasa_001",
    "label": "Charaka Samhita — manas (mental health) principles",
    "knowledge_source_type": "classical_text",
    "classical_text_ref": "Charaka Samhita",
    "chapter_ref": "Sutra Sthana 8",
    "verse_ref": "8.1-18",
    "tkrc_body_system": "mental_wellbeing",
    "tkrc_therapeutic_area": "stress_regulation",
    "prior_art_reference_type": "classical_text",
    "confidence_level": "high",
    "human_review_status": "reviewed",
    "tags": ["mental", "manas", "stress", "satva", "wellbeing"]
  }
]
