[
  {
    "id": "rec_evening_winddown_001",
    "label": "gentle evening wind-down routine",
    "knowledge_source_type": "internal_rule",
    "dosage_form_category": "lifestyle",
    "tkrc_body_system": "sleep",
    "tkrc_therapeutic_area": "nidra_support",
    "dosha_action_profile": { "vata": "down", "pitta": "down", "kapha": "neutral" },
    "indication_band": "routine_support",
    "safety_band": "low_risk",
    "watch_suitability": "high",
    "contraindication_flags": [],
    "escalation_triggers": [],
    "prior_art_reference_type": "internal_logic_rule",
    "confidence_level": "high",
    "human_review_status": "reviewed",
    "tags": ["sleep", "routine", "breathwork", "screen_hygiene"]
  },
  {
    "id": "rec_morning_dinacharya_001",
    "label": "morning dinacharya — wake at sunrise, tongue scraping, warm water",
    "knowledge_source_type": "classical_text",
    "classical_text_ref": "Charaka Samhita",
    "chapter_ref": "Sutra Sthana 5",
    "dosage_form_category": "lifestyle",
    "tkrc_body_system": "daily_routine",
    "tkrc_therapeutic_area": "daily_routine_support",
    "dosha_action_profile": { "vata": "down", "pitta": "neutral", "kapha": "down" },
    "indication_band": "routine_support",
    "safety_band": "low_risk",
    "watch_suitability": "high",
    "contraindication_flags": [],
    "escalation_triggers": [],
    "prior_art_reference_type": "classical_text",
    "confidence_level": "high",
    "human_review_status": "reviewed",
    "tags": ["dinacharya", "morning", "routine", "agni"]
  },
  {
    "id": "rec_warm_water_hydration_001",
    "label": "sip warm water throughout the day",
    "knowledge_source_type": "internal_rule",
    "dosage_form_category": "dietary_pattern",
    "tkrc_body_system": "digestive",
    "tkrc_therapeutic_area": "agni_support",
    "dosha_action_profile": { "vata": "down", "pitta": "neutral", "kapha": "down" },
    "indication_band": "mild_general",
    "safety_band": "low_risk",
    "watch_suitability": "high",
    "contraindication_flags": [],
    "escalation_triggers": [],
    "prior_art_reference_type": "internal_logic_rule",
    "confidence_level": "high",
    "human_review_status": "reviewed",
    "tags": ["hydration", "agni", "digestive", "daily"]
  },
  {
    "id": "rec_pranayama_nadi_shodhana_001",
    "label": "nadi shodhana pranayama — alternate nostril breathing",
    "knowledge_source_type": "classical_text",
    "classical_text_ref": "Charaka Samhita",
    "chapter_ref": "Sutra Sthana 11",
    "dosage_form_category": "breathwork",
    "tkrc_body_system": "mental_wellbeing",
    "tkrc_therapeutic_area": "stress_regulation",
    "dosha_action_profile": { "vata": "down", "pitta": "down", "kapha": "neutral" },
    "indication_band": "stress_related",
    "safety_band": "low_risk",
    "watch_suitability": "high",
    "contraindication_flags": [],
    "escalation_triggers": ["breathing_difficulty"],
    "prior_art_reference_type": "classical_text",
    "confidence_level": "high",
    "human_review_status": "reviewed",
    "tags": ["pranayama", "breathwork", "stress", "vata", "pitta"]
  },
  {
    "id": "rec_light_yoga_morning_001",
    "label": "gentle morning yoga — surya namaskar at slow pace",
    "knowledge_source_type": "internal_rule",
    "dosage_form_category": "movement",
    "tkrc_body_system": "musculoskeletal",
    "tkrc_therapeutic_area": "daily_routine_support",
    "dosha_action_profile": { "vata": "down", "pitta": "neutral", "kapha": "down" },
    "indication_band": "routine_support",
    "safety_band": "low_risk",
    "watch_suitability": "high",
    "contraindication_flags": ["severe_pain"],
    "escalation_triggers": [],
    "prior_art_reference_type": "internal_logic_rule",
    "confidence_level": "high",
    "human_review_status": "reviewed",
    "tags": ["yoga", "movement", "morning", "kapha", "routine"]
  },
  {
    "id": "rec_seasonal_diet_kapha_001",
    "label": "light warm foods in kapha season — avoid heavy oily meals",
    "knowledge_source_type": "classical_text",
    "classical_text_ref": "Charaka Samhita",
    "chapter_ref": "Sutra Sthana 6",
    "dosage_form_category": "dietary_pattern",
    "tkrc_body_system": "digestive",
    "tkrc_therapeutic_area": "kapha_management",
    "dosha_action_profile": { "vata": "neutral", "pitta": "neutral", "kapha": "down" },
    "indication_band": "seasonal_balance",
    "safety_band": "low_risk",
    "watch_suitability": "high",
    "contraindication_flags": [],
    "escalation_triggers": [],
    "prior_art_reference_type": "classical_text",
    "confidence_level": "high",
    "human_review_status": "reviewed",
    "tags": ["diet", "kapha", "seasonal", "agni", "digestive"]
  },
  {
    "id": "rec_abhyanga_self_massage_001",
    "label": "daily self-massage (abhyanga) with warm sesame oil",
    "knowledge_source_type": "classical_text",
    "classical_text_ref": "Charaka Samhita",
    "chapter_ref": "Sutra Sthana 5",
    "dosage_form_category": "external_practice",
    "tkrc_body_system": "musculoskeletal",
    "tkrc_therapeutic_area": "daily_routine_support",
    "dosha_action_profile": { "vata": "down", "pitta": "neutral", "kapha": "neutral" },
    "indication_band": "routine_support",
    "safety_band": "low_risk",
    "watch_suitability": "medium",
    "contraindication_flags": [],
    "escalation_triggers": [],
    "prior_art_reference_type": "classical_text",
    "confidence_level": "high",
    "human_review_status": "reviewed",
    "tags": ["abhyanga", "massage", "vata", "skin", "dinacharya"]
  },
  {
    "id": "rec_sleep_hygiene_001",
    "label": "fixed sleep schedule — lights out by 10 PM, phone off",
    "knowledge_source_type": "internal_rule",
    "dosage_form_category": "lifestyle",
    "tkrc_body_system": "sleep",
    "tkrc_therapeutic_area": "nidra_support",
    "dosha_action_profile": { "vata": "down", "pitta": "down", "kapha": "neutral" },
    "indication_band": "routine_support",
    "safety_band": "low_risk",
    "watch_suitability": "high",
    "contraindication_flags": [],
    "escalation_triggers": [],
    "prior_art_reference_type": "internal_logic_rule",
    "confidence_level": "high",
    "human_review_status": "reviewed",
    "tags": ["sleep", "routine", "nidra", "screen_hygiene"]
  }
]
